{
  "inventory_version": "1.0.0",
  "baseline_sha": "d61fbb67a307c9070a2e1e2fb229cdabe2097da3",
  "baseline_tree": "53663cb07f5b85924789ad0ff6ee73658aaca8cd",
  "generated_at": "2026-09-11T17:21:15.385240+00:00",
  "classification": "PUBLIC",
  "provenance": {
    "classification": "MIXED",
    "human_direction": "Maintainer S-01 request",
    "ai_assistance": "OpenAI Codex analysis and artifact drafting",
    "input_sources": [
      "current protected-main source/tests/contracts/docs",
      "Docs/SMF_Benchmark_Testhandbuch.pdf",
      "Docs/SemantIQ-Benchmarks.pdf"
    ],
    "external_research": "No external research or restricted materials used",
    "verification": "Source inspection, PDF extraction with two visual spot-checks, bounded tests and validators; see decision record"
  },
  "scope": {
    "included": "SemantIQ Core and generic benchmark/evidence infrastructure",
    "excluded": "Cyber implementation, restricted research, exploit/patch intelligence and protected algorithms",
    "inventory_unit": "Capability or benchmark family/named pack; test-local arbitrary IDs are examples, not separately counted benchmarks",
    "status_semantics": "IMPLEMENTED refers to stated engineering behavior only; PARTIAL means a component is functional but family workflow incomplete; SCAFFOLDED means mock/fixed/descriptor path; DOCUMENTED_ONLY has no execution; historical records are separate and overlapping, never added to current counts",
    "negative_evidence": "ABSENT means not found in bounded current-source/contract/test search, not proof about unavailable systems"
  },
  "counts": {
    "current_family_or_pack_records": 22,
    "implemented": 1,
    "partial": 10,
    "scaffolded": 9,
    "documented_only": 2,
    "historical_reconciliation_records": 22,
    "historical_handbook_prompt_templates": 84,
    "scientifically_validated_benchmarks": 0,
    "metric_system_records": 31,
    "evaluator_mechanism_records": 10
  },
  "capabilities": [
    {
      "capability_id": "C01",
      "name": "Benchmark registry, definitions and lifecycle",
      "category": "catalog",
      "source_paths": [
        "packages/evidence/src/evaluation-ledger/dataset-case-registry.ts",
        "packages/sandbox-contracts/src/product-contracts.ts",
        "packages/semantiq/src/ecosystem.ts"
      ],
      "test_paths": [
        "tests/unit/evaluation-ledger-provenance.test.ts",
        "tests/unit/ecosystem.test.ts"
      ],
      "schema_paths": [
        "schemas/product-contracts.schema.json",
        "schemas/sandbox-benchmark-dsl.schema.json"
      ],
      "documentation_paths": ["Docs/benchmarks/README.md"],
      "public_interfaces": ["DatasetCaseRegistry", "Benchmark", "Case", "SandboxBenchmarkCompiler"],
      "runtime_status": "PARTIAL",
      "evidence_strength": "SOURCE_AND_TESTS",
      "finding": "Typed contracts, seed dataset metadata and ecosystem listing exist; no single registry binds all execution paths to constructs, evaluators, maturity and retirement.",
      "engineering_maturity": "TESTED_COMPONENT",
      "scientific_maturity": "NOT_ESTABLISHED",
      "strategic_importance": "HIGH",
      "gap": "Resolve naming, identity, provenance and lifecycle across paths.",
      "recommended_destination_phase": "S02"
    },
    {
      "capability_id": "C02",
      "name": "Local semantic scaffold",
      "category": "scoring",
      "source_paths": ["packages/semantiq/src/index.ts", "tools/automation/first-result.ts"],
      "test_paths": ["tests/unit/first-result-path.test.ts"],
      "schema_paths": ["packages/semantiq/src/contracts.ts"],
      "documentation_paths": ["Docs/QUICK_START.md"],
      "public_interfaces": [
        "LocalSemantiqEngine.evaluate",
        "compare",
        "getHistory",
        "exportReport"
      ],
      "runtime_status": "SCAFFOLDED",
      "evidence_strength": "SOURCE_AND_TESTS",
      "finding": "Scores depend on serialized content length; every selected dimension uses the same formula and confidence 0.5.",
      "engineering_maturity": "TESTED_COMPONENT",
      "scientific_maturity": "UNVALIDATED_PROXY",
      "strategic_importance": "HIGH",
      "gap": "Keep explicit demo status; replace semantic claims only after operationalization.",
      "recommended_destination_phase": "S03"
    },
    {
      "capability_id": "C03",
      "name": "Explainable semantic and question heuristics",
      "category": "scoring",
      "source_paths": ["packages/semantiq/src/runtime.ts", "packages/sprint2-runtime/src/index.ts"],
      "test_paths": ["packages/sprint2-runtime/tests/sprint2-runtime.test.ts"],
      "schema_paths": ["packages/semantiq/src/contracts.ts"],
      "documentation_paths": ["specs/010-semantiq-benchmark-engine.md"],
      "public_interfaces": [
        "ExplainableSemantiqRuntime.runSemantiq",
        "LocalSprint2Runtime.evaluateQuestion",
        "evaluateEvidence"
      ],
      "runtime_status": "PARTIAL",
      "evidence_strength": "SOURCE_AND_TESTS",
      "finding": "Content length/evidence bonus and lexical rubric signals compute scores; labels do not establish semantic constructs.",
      "engineering_maturity": "TESTED_COMPONENT",
      "scientific_maturity": "UNVALIDATED_PROXY",
      "strategic_importance": "HIGH",
      "gap": "Separate measured lexical features from desired constructs.",
      "recommended_destination_phase": "S03"
    },
    {
      "capability_id": "C04",
      "name": "SMF/HACS/Vision producers",
      "category": "benchmarks",
      "source_paths": ["packages/benchmark/src/engine.ts", "packages/benchmark/src/adapter.ts"],
      "test_paths": ["tests/unit/benchmark-engine-producer.test.ts"],
      "schema_paths": ["schemas/product-contracts.schema.json"],
      "documentation_paths": ["Docs/ARCHITECTURE.md"],
      "public_interfaces": ["BenchmarkProducerEngine.executeBenchmark"],
      "runtime_status": "SCAFFOLDED",
      "evidence_strength": "SOURCE_AND_TESTS",
      "finding": "Three selectable families produce fixed dimension values; system profile does not trigger model inference.",
      "engineering_maturity": "TESTED_COMPONENT",
      "scientific_maturity": "SYNTHETIC_ONLY",
      "strategic_importance": "HIGH",
      "gap": "Replace generated performance assertions with evidence-linked execution in a later gate.",
      "recommended_destination_phase": "S02"
    },
    {
      "capability_id": "C05",
      "name": "Generic behavioral evaluation",
      "category": "metrics",
      "source_paths": [
        "packages/evidence/src/behavioral-metrics/metric-definitions.ts",
        "packages/sandbox-contracts/src/long-horizon.ts",
        "packages/sandbox-contracts/src/recovery-testing.ts",
        "packages/sandbox-contracts/src/consequence-testing.ts"
      ],
      "test_paths": [
        "tests/unit/behavioral-metrics-engine.test.ts",
        "tests/unit/long-horizon.test.ts",
        "tests/unit/recovery-testing.test.ts",
        "tests/unit/consequence-testing.test.ts"
      ],
      "schema_paths": ["packages/evidence/src/behavioral-metrics/types.ts"],
      "documentation_paths": ["Docs/RESEARCH_WORKFLOW.md"],
      "public_interfaces": [
        "BehavioralMetricsEngine",
        "LongHorizonTestingEngine",
        "RecoveryTestingEngine",
        "ConsequenceTestingEngine"
      ],
      "runtime_status": "PARTIAL",
      "evidence_strength": "SOURCE_AND_TESTS",
      "finding": "Input-derived arithmetic and trace heuristics exist. Named intelligence, awareness and resilience constructs lack calibration evidence.",
      "engineering_maturity": "TESTED_COMPONENT",
      "scientific_maturity": "UNVALIDATED_PROXY",
      "strategic_importance": "HIGH",
      "gap": "Specify denominators, missingness, target populations and annotation validity.",
      "recommended_destination_phase": "S03"
    },
    {
      "capability_id": "C06",
      "name": "Statistical contrasts and robustness",
      "category": "measurement_science",
      "source_paths": [
        "packages/evidence/src/statistical-contrast/statistical-contrast-engine.ts",
        "packages/evidence/src/statistical-contrast/run-profile-matcher.ts",
        "packages/evidence/src/robustness-diagnostics/robustness-engine.ts",
        "packages/sandbox-contracts/src/cross-comparison.ts"
      ],
      "test_paths": [
        "tests/unit/matched-statistical-contrast.test.ts",
        "tests/unit/robustness-specification.test.ts",
        "tests/unit/cross-comparison.test.ts"
      ],
      "schema_paths": ["packages/evidence/src/statistical-contrast/types.ts"],
      "documentation_paths": ["Docs/RESEARCH_WORKFLOW.md"],
      "public_interfaces": [
        "ComparisonsService",
        "StatisticalContrastEngine",
        "RobustnessEngine",
        "CrossComparisonEngine"
      ],
      "runtime_status": "PARTIAL",
      "evidence_strength": "SOURCE_AND_TESTS",
      "finding": "Seeded bootstrap, exact sign test, TVD and leave-out diagnostics exist; separate ranking path uses fixed confidence margin and hardcoded significance.",
      "engineering_maturity": "TESTED_COMPONENT",
      "scientific_maturity": "COMPUTED_NOT_VALIDATED",
      "strategic_importance": "HIGH",
      "gap": "Converge on justified estimators; characterize small-sample, missing-data and selection behavior.",
      "recommended_destination_phase": "S03"
    },
    {
      "capability_id": "C07",
      "name": "Evidence ingestion, mapping and ledger",
      "category": "evidence",
      "source_paths": [
        "packages/semantiq/src/services/runs-service.ts",
        "packages/semantiq/src/services/evaluations-service.ts",
        "packages/evidence/src/trace-mapper-engine.ts",
        "packages/evidence/src/evaluation-ledger/evaluation-ledger.ts"
      ],
      "test_paths": [
        "tests/unit/trace-mapping-provenance.test.ts",
        "tests/unit/evaluation-ledger-provenance.test.ts",
        "tests/unit/unified-application-services.test.ts"
      ],